{
  "$schema": "http://json-schema.org/draft-07/schema#",
  "title": "中医信息学 v1 · 三层信息结构",
  "version": "1.0.0",
  "description": "S 信息标准层 × A 数据资产层 × M 信息挖掘算子层。",
  "type": "object",
  "required": [
    "meta",
    "standards",
    "assets",
    "operators",
    "distributions",
    "rules",
    "stats"
  ],
  "properties": {
    "meta": {
      "type": "object"
    },
    "stats": {
      "type": "object"
    },
    "standards": {
      "type": "array"
    },
    "assets": {
      "type": "array"
    },
    "operators": {
      "type": "array"
    },
    "distributions": {
      "type": "object"
    },
    "rules": {
      "type": "object"
    },
    "clusters": {
      "type": "array"
    },
    "cluster_edges": {
      "type": "array"
    },
    "icd_coverage": {
      "type": "object"
    },
    "data_quality": {
      "type": "object"
    }
  }
}